{
  "entry_points": {
    "main": {
      "inputs": {},
      "outputs": {
        "_": {
          "max_length": 10,
          "required": true,
          "type": "text"
        }
      },
      "prompt": "main"
    }
  },
  "metadata": {
    "format": "sta",
    "hash": "bbfbd0621ab1e4b7edd6a05c87daf6ad5da179149ba4b4266bee8cd4e0ae48e5",
    "timestamp": "1970-01-01T00:00:00Z",
    "version": "0.0.0"
  },
  "prompts": {
    "main": {
      "abstracts": [
        {
          "exit": -1,
          "field": -1,
          "flow": 1
        },
        {
          "exit": 2,
          "field": 0,
          "flow": -1
        },
        {
          "exit": 3,
          "field": 1,
          "flow": -1
        },
        {
          "exit": 4,
          "field": 2,
          "flow": 3
        },
        {
          "exit": 5,
          "field": 3,
          "flow": -1
        },
        {
          "exit": 0,
          "field": 4,
          "flow": -1
        }
      ],
      "channels": [],
      "desc": [],
      "fields": [
        {
          "depth": 1,
          "desc": [],
          "flat_index": 0,
          "format": {
            "length": 10,
            "type": "completion"
          },
          "index": 0,
          "name": "short",
          "range": null
        },
        {
          "depth": 1,
          "desc": [],
          "flat_index": 1,
          "format": {
            "length": 15,
            "type": "completion"
          },
          "index": 1,
          "name": "long",
          "range": null
        },
        {
          "depth": 1,
          "desc": [],
          "flat_index": 2,
          "format": {
            "length": 10,
            "type": "completion"
          },
          "index": 2,
          "name": "items",
          "range": [
            6,
            6
          ]
        },
        {
          "depth": 1,
          "desc": [],
          "flat_index": 3,
          "format": {
            "length": 20,
            "type": "completion"
          },
          "index": 3,
          "name": "scaled",
          "range": null
        },
        {
          "depth": 1,
          "desc": [
            "the next step"
          ],
          "flat_index": 4,
          "format": {
            "type": "enum",
            "values": [
              "return"
            ]
          },
          "index": 4,
          "name": "next",
          "range": null
        }
      ],
      "flows": {
        "return": {
          "fields": [
            {
              "alias": "_",
              "path": [
                {
                  "name": "short"
                }
              ]
            }
          ],
          "type": "return"
        }
      },
      "name": "main"
    }
  },
  "provenance": {},
  "python_imports": {}
}
