{
  "entry_points": {
    "main": {
      "inputs": {
        "long": {
          "max_length": 50,
          "required": true,
          "type": "text"
        },
        "simple": {
          "max_length": 10,
          "required": true,
          "type": "text"
        },
        "tech": {
          "max_length": 20,
          "required": true,
          "type": "text"
        }
      },
      "outputs": {
        "_": {
          "max_length": 20,
          "required": true,
          "type": "text"
        }
      },
      "prompt": "main"
    }
  },
  "metadata": {
    "format": "sta",
    "hash": "272b92091a7c657854b2fba325ea7af70ddc83ecee0235ac03fa2bd5f77500d1",
    "timestamp": "1970-01-01T00:00:00Z",
    "version": "0.0.0"
  },
  "prompts": {
    "main": {
      "abstracts": [
        {
          "exit": -1,
          "field": -1,
          "flow": 1
        },
        {
          "exit": 2,
          "field": 0,
          "flow": -1
        },
        {
          "exit": 3,
          "field": 1,
          "flow": -1
        },
        {
          "exit": 4,
          "field": 2,
          "flow": -1
        },
        {
          "exit": 0,
          "field": 3,
          "flow": -1
        }
      ],
      "channels": [
        {
          "source": [
            {
              "name": "simple"
            }
          ],
          "target": [
            {
              "name": "simple"
            }
          ],
          "type": "input"
        },
        {
          "source": [
            {
              "name": "long"
            }
          ],
          "target": [
            {
              "name": "long"
            }
          ],
          "type": "input"
        },
        {
          "source": [
            {
              "name": "tech"
            }
          ],
          "target": [
            {
              "name": "tech"
            }
          ],
          "type": "input"
        }
      ],
      "desc": [],
      "fields": [
        {
          "depth": 1,
          "desc": [
            "A formal message."
          ],
          "flat_index": 0,
          "format": {
            "length": 10,
            "type": "completion"
          },
          "format_ref": "SimpleMessage",
          "index": 0,
          "name": "simple",
          "range": null,
          "search": {
            "text": {
              "ahead": "__search__.text.ahead",
              "beams": "__search__.text.beams",
              "diversity": "__search__.text.diversity",
              "repetition": "__search__.text.repetition",
              "threshold": "__search__.text.threshold",
              "topk": "__search__.text.topk",
              "width": "__search__.text.width"
            }
          }
        },
        {
          "depth": 1,
          "desc": [
            "A casual message."
          ],
          "flat_index": 1,
          "format": {
            "length": 50,
            "type": "completion"
          },
          "format_ref": "LongCasualMessage",
          "index": 1,
          "name": "long",
          "range": null,
          "search": {
            "text": {
              "ahead": "__search__.text.ahead",
              "beams": "__search__.text.beams",
              "diversity": "__search__.text.diversity",
              "repetition": "__search__.text.repetition",
              "threshold": "__search__.text.threshold",
              "topk": "__search__.text.topk",
              "width": "__search__.text.width"
            }
          }
        },
        {
          "depth": 1,
          "desc": [
            "A technical message."
          ],
          "flat_index": 2,
          "format": {
            "length": 20,
            "type": "completion"
          },
          "format_ref": "TechnicalMessage",
          "index": 2,
          "name": "tech",
          "range": null,
          "search": {
            "text": {
              "ahead": "__search__.text.ahead",
              "beams": "__search__.text.beams",
              "diversity": "__search__.text.diversity",
              "repetition": "__search__.text.repetition",
              "threshold": "__search__.text.threshold",
              "topk": "__search__.text.topk",
              "width": "__search__.text.width"
            }
          }
        },
        {
          "depth": 1,
          "desc": [
            "the next step"
          ],
          "flat_index": 3,
          "format": {
            "type": "enum",
            "values": [
              "return"
            ]
          },
          "index": 3,
          "name": "next",
          "range": null
        }
      ],
      "flows": {
        "return": {
          "fields": [
            {
              "alias": "_",
              "path": [
                {
                  "name": "simple"
                }
              ]
            },
            {
              "alias": "_",
              "path": [
                {
                  "name": "long"
                }
              ]
            },
            {
              "alias": "_",
              "path": [
                {
                  "name": "tech"
                }
              ]
            }
          ],
          "type": "return"
        }
      },
      "name": "main",
      "search": {
        "queue": {
          "metric": "__search__.queue.metric",
          "stop": "__search__.queue.stop"
        }
      }
    }
  },
  "provenance": {},
  "python_imports": {}
}
