{
  "entry_points": {
    "main": {
      "inputs": {
        "seed": {
          "required": true,
          "type": "text"
        }
      },
      "outputs": {
        "_": {
          "items": {
            "max_length": 99,
            "type": "text"
          },
          "max_items": 3,
          "min_items": 1,
          "required": true,
          "type": "array"
        }
      },
      "prompt": "main"
    }
  },
  "metadata": {
    "format": "sta",
    "hash": "a567b498ba3522e9531ecd88ea66db45a1d921bb72e80085512e7f48f0df798a",
    "timestamp": "1970-01-01T00:00:00Z",
    "version": "0.0.0"
  },
  "prompts": {
    "main": {
      "abstracts": [
        {
          "exit": -1,
          "field": -1,
          "flow": 1
        },
        {
          "exit": 2,
          "field": 0,
          "flow": 1
        },
        {
          "exit": 0,
          "field": 1,
          "flow": -1
        }
      ],
      "channels": [
        {
          "clauses": [
            {
              "source": [
                {
                  "name": "_"
                }
              ],
              "target": [
                {
                  "name": "response"
                }
              ],
              "type": "bind"
            }
          ],
          "entry": "refine__12",
          "extern": null,
          "kwargs": [
            {
              "clauses": [],
              "is_input": true,
              "name": "seed",
              "path": [
                {
                  "name": "seed"
                }
              ],
              "prompt": null,
              "value": null
            }
          ],
          "target": [
            {
              "name": "got"
            }
          ],
          "type": "call"
        }
      ],
      "desc": [],
      "fields": [
        {
          "depth": 1,
          "desc": [],
          "flat_index": 0,
          "format": {
            "length": 99,
            "type": "completion"
          },
          "index": 0,
          "name": "got",
          "range": [
            1,
            3
          ],
          "search": {
            "text": {
              "ahead": "__search__.text.ahead",
              "beams": "__search__.text.beams",
              "diversity": "__search__.text.diversity",
              "repetition": "__search__.text.repetition",
              "threshold": "__search__.text.threshold",
              "topk": "__search__.text.topk",
              "width": "__search__.text.width"
            }
          }
        },
        {
          "depth": 1,
          "desc": [
            "the next step"
          ],
          "flat_index": 1,
          "format": {
            "type": "enum",
            "values": [
              "return"
            ]
          },
          "index": 1,
          "name": "next",
          "range": null
        }
      ],
      "flows": {
        "return": {
          "fields": [
            {
              "alias": "_",
              "path": [
                {
                  "name": "got"
                }
              ]
            }
          ],
          "type": "return"
        }
      },
      "name": "main",
      "search": {
        "queue": {
          "metric": "__search__.queue.metric",
          "stop": "__search__.queue.stop"
        }
      }
    },
    "refine__12": {
      "abstracts": [
        {
          "exit": -1,
          "field": -1,
          "flow": 1
        },
        {
          "exit": 2,
          "field": 0,
          "flow": 1
        },
        {
          "exit": 3,
          "field": 1,
          "flow": -1
        },
        {
          "exit": 0,
          "field": 2,
          "flow": -1
        }
      ],
      "channels": [
        {
          "source": [
            {
              "name": "seed"
            }
          ],
          "target": [
            {
              "name": "out"
            }
          ],
          "type": "input"
        }
      ],
      "desc": [],
      "fields": [
        {
          "depth": 1,
          "desc": [],
          "flat_index": 0,
          "format": {
            "length": 12,
            "type": "completion"
          },
          "index": 0,
          "name": "out",
          "range": [
            1,
            3
          ],
          "search": {
            "text": {
              "ahead": "__search__.text.ahead",
              "beams": "__search__.text.beams",
              "diversity": "__search__.text.diversity",
              "repetition": "__search__.text.repetition",
              "threshold": "__search__.text.threshold",
              "topk": "__search__.text.topk",
              "width": "__search__.text.width"
            }
          }
        },
        {
          "depth": 1,
          "desc": [],
          "flat_index": 1,
          "format": {
            "length": 12,
            "type": "completion"
          },
          "index": 1,
          "name": "pad",
          "range": null,
          "search": {
            "text": {
              "ahead": "__search__.text.ahead",
              "beams": "__search__.text.beams",
              "diversity": "__search__.text.diversity",
              "repetition": "__search__.text.repetition",
              "threshold": "__search__.text.threshold",
              "topk": "__search__.text.topk",
              "width": "__search__.text.width"
            }
          }
        },
        {
          "depth": 1,
          "desc": [
            "the next step"
          ],
          "flat_index": 2,
          "format": {
            "type": "enum",
            "values": [
              "return"
            ]
          },
          "index": 2,
          "name": "next",
          "range": null
        }
      ],
      "flows": {
        "return": {
          "fields": [
            {
              "alias": "response",
              "path": [
                {
                  "name": "out"
                }
              ]
            }
          ],
          "type": "return"
        }
      },
      "name": "refine__12",
      "search": {
        "queue": {
          "metric": "__search__.queue.metric",
          "stop": "__search__.queue.stop"
        }
      }
    }
  },
  "provenance": {},
  "python_imports": {}
}
