{
  "entry_points": {
    "main": {
      "inputs": {},
      "outputs": {
        "item": {
          "required": true,
          "type": "text"
        }
      },
      "prompt": "test"
    }
  },
  "metadata": {
    "format": "sta",
    "hash": "d53759db8c61df2cb4403dcfcfc556392552ec3c8ae8bae2509666e9f9db0a6b",
    "timestamp": "1970-01-01T00:00:00Z",
    "version": "0.0.0"
  },
  "prompts": {
    "test": {
      "abstracts": [
        {
          "exit": -1,
          "field": -1,
          "flow": 1
        },
        {
          "exit": 0,
          "field": 0,
          "flow": -1
        }
      ],
      "channels": [],
      "desc": [],
      "fields": [
        {
          "depth": 1,
          "desc": [],
          "flat_index": 0,
          "format": {
            "type": "completion"
          },
          "format_ref": "Item",
          "index": 0,
          "name": "item",
          "range": null,
          "search": {
            "text": {
              "ahead": "__search__.text.ahead",
              "beams": "__search__.text.beams",
              "diversity": "__search__.text.diversity",
              "repetition": "__search__.text.repetition",
              "threshold": "__search__.text.threshold",
              "topk": "__search__.text.topk",
              "width": "__search__.text.width"
            }
          }
        }
      ],
      "flows": {},
      "name": "test",
      "search": {
        "queue": {
          "metric": "__search__.queue.metric",
          "stop": "__search__.queue.stop"
        }
      }
    }
  },
  "provenance": {},
  "python_imports": {}
}
