{
  "entry_points": {
    "main": {
      "inputs": {
        "topic": {
          "max_length": 10,
          "required": true,
          "type": "text"
        }
      },
      "outputs": {
        "_": {
          "max_length": 20,
          "required": true,
          "type": "text"
        }
      },
      "prompt": "main"
    }
  },
  "metadata": {
    "format": "sta",
    "hash": "f79e671fe1a6ceae1ecb28a504a2b780b3cec47b0bf48bf4c89652408d482c85",
    "timestamp": "1970-01-01T00:00:00Z",
    "version": "0.0.0"
  },
  "prompts": {
    "main": {
      "abstracts": [
        {
          "exit": -1,
          "field": -1,
          "flow": 1
        },
        {
          "exit": 2,
          "field": 0,
          "flow": -1
        },
        {
          "exit": 3,
          "field": 1,
          "flow": -1
        },
        {
          "exit": 0,
          "field": 2,
          "flow": -1
        }
      ],
      "channels": [
        {
          "source": [
            {
              "name": "topic"
            }
          ],
          "target": [
            {
              "name": "topic"
            }
          ],
          "type": "input"
        },
        {
          "clauses": [],
          "entry": "worker",
          "extern": null,
          "kwargs": [
            {
              "clauses": [],
              "is_input": true,
              "name": "topic",
              "path": [
                {
                  "name": "topic"
                }
              ],
              "prompt": null,
              "value": null
            }
          ],
          "target": [
            {
              "name": "answer"
            }
          ],
          "type": "call"
        }
      ],
      "desc": [],
      "fields": [
        {
          "depth": 1,
          "desc": [],
          "flat_index": 0,
          "format": {
            "length": 10,
            "type": "completion"
          },
          "index": 0,
          "name": "topic",
          "range": null,
          "search": {
            "text": {
              "ahead": "__search__.text.ahead",
              "beams": "__search__.text.beams",
              "diversity": "__search__.text.diversity",
              "repetition": "__search__.text.repetition",
              "threshold": "__search__.text.threshold",
              "topk": "__search__.text.topk",
              "width": "__search__.text.width"
            }
          }
        },
        {
          "depth": 1,
          "desc": [],
          "flat_index": 1,
          "format": {
            "length": 20,
            "type": "completion"
          },
          "index": 1,
          "name": "answer",
          "range": null,
          "search": {
            "text": {
              "ahead": "__search__.text.ahead",
              "beams": "__search__.text.beams",
              "diversity": "__search__.text.diversity",
              "repetition": "__search__.text.repetition",
              "threshold": "__search__.text.threshold",
              "topk": "__search__.text.topk",
              "width": "__search__.text.width"
            }
          }
        },
        {
          "depth": 1,
          "desc": [
            "the next step"
          ],
          "flat_index": 2,
          "format": {
            "type": "enum",
            "values": [
              "return"
            ]
          },
          "index": 2,
          "name": "next",
          "range": null
        }
      ],
      "flows": {
        "return": {
          "fields": [
            {
              "alias": "_",
              "path": [
                {
                  "name": "answer"
                }
              ]
            }
          ],
          "type": "return"
        }
      },
      "name": "main",
      "search": {
        "queue": {
          "metric": "__search__.queue.metric",
          "stop": "__search__.queue.stop"
        }
      }
    },
    "worker": {
      "abstracts": [
        {
          "exit": -1,
          "field": -1,
          "flow": 1
        },
        {
          "exit": 2,
          "field": 0,
          "flow": -1
        },
        {
          "exit": 3,
          "field": 1,
          "flow": -1
        },
        {
          "exit": 0,
          "field": 2,
          "flow": -1
        }
      ],
      "channels": [
        {
          "source": [
            {
              "name": "topic"
            }
          ],
          "target": [
            {
              "name": "topic"
            }
          ],
          "type": "input"
        }
      ],
      "desc": [],
      "fields": [
        {
          "depth": 1,
          "desc": [],
          "flat_index": 0,
          "format": {
            "length": 10,
            "type": "completion"
          },
          "index": 0,
          "name": "topic",
          "range": null,
          "search": {
            "text": {
              "ahead": "__search__.text.ahead",
              "beams": "__search__.text.beams",
              "diversity": "__search__.text.diversity",
              "repetition": "__search__.text.repetition",
              "threshold": "__search__.text.threshold",
              "topk": "__search__.text.topk",
              "width": "__search__.text.width"
            }
          }
        },
        {
          "depth": 1,
          "desc": [],
          "flat_index": 1,
          "format": {
            "length": 20,
            "type": "completion"
          },
          "index": 1,
          "name": "result",
          "range": null,
          "search": {
            "text": {
              "ahead": "__search__.text.ahead",
              "beams": "__search__.text.beams",
              "diversity": "__search__.text.diversity",
              "repetition": "__search__.text.repetition",
              "threshold": "__search__.text.threshold",
              "topk": "__search__.text.topk",
              "width": "__search__.text.width"
            }
          }
        },
        {
          "depth": 1,
          "desc": [
            "the next step"
          ],
          "flat_index": 2,
          "format": {
            "type": "enum",
            "values": [
              "return"
            ]
          },
          "index": 2,
          "name": "next",
          "range": null
        }
      ],
      "flows": {
        "return": {
          "fields": [
            {
              "alias": "_",
              "path": [
                {
                  "name": "result"
                }
              ]
            }
          ],
          "type": "return"
        }
      },
      "name": "worker",
      "search": {
        "queue": {
          "metric": "__search__.queue.metric",
          "stop": "__search__.queue.stop"
        }
      }
    }
  },
  "provenance": {},
  "python_imports": {}
}
