{
  "entry_points": {
    "main": {
      "inputs": {
        "topic": {
          "max_length": 10,
          "required": true,
          "type": "text"
        }
      },
      "outputs": {
        "_": {
          "max_length": 20,
          "required": true,
          "type": "text"
        }
      },
      "prompt": "solver"
    }
  },
  "metadata": {
    "format": "sta",
    "hash": "52140c0a84b55f3308f095e5101710fee6bf3c4538ff0a38815ed9b7eb6bbb2e",
    "timestamp": "1970-01-01T00:00:00Z",
    "version": "0.0.0"
  },
  "prompts": {
    "solver": {
      "abstracts": [
        {
          "exit": -1,
          "field": -1,
          "flow": 1
        },
        {
          "exit": 2,
          "field": 0,
          "flow": -1
        },
        {
          "exit": 3,
          "field": 1,
          "flow": 2
        },
        {
          "exit": 4,
          "field": 2,
          "flow": -1
        },
        {
          "exit": 0,
          "field": 3,
          "flow": -1
        }
      ],
      "channels": [
        {
          "source": [
            {
              "name": "topic"
            }
          ],
          "target": [
            {
              "name": "topic"
            }
          ],
          "type": "input"
        },
        {
          "clauses": [],
          "prompt": null,
          "source": [
            {
              "name": "attempt"
            }
          ],
          "target": [
            {
              "name": "hint"
            }
          ],
          "type": "dataflow"
        }
      ],
      "desc": [],
      "fields": [
        {
          "depth": 1,
          "desc": [],
          "flat_index": 0,
          "format": {
            "length": 10,
            "type": "completion"
          },
          "index": 0,
          "name": "topic",
          "range": null,
          "search": {
            "text": {
              "ahead": "__search__.text.ahead",
              "beams": "__search__.text.beams",
              "diversity": "__search__.text.diversity",
              "repetition": "__search__.text.repetition",
              "threshold": "__search__.text.threshold",
              "topk": "__search__.text.topk",
              "width": "__search__.text.width"
            }
          }
        },
        {
          "depth": 1,
          "desc": [],
          "flat_index": 1,
          "format": {
            "length": 15,
            "type": "completion"
          },
          "index": 1,
          "name": "hint",
          "range": [
            0,
            1
          ],
          "search": {
            "text": {
              "ahead": "__search__.text.ahead",
              "beams": "__search__.text.beams",
              "diversity": "__search__.text.diversity",
              "repetition": "__search__.text.repetition",
              "threshold": "__search__.text.threshold",
              "topk": "__search__.text.topk",
              "width": "__search__.text.width"
            }
          }
        },
        {
          "depth": 1,
          "desc": [],
          "flat_index": 2,
          "format": {
            "length": 20,
            "type": "completion"
          },
          "index": 2,
          "name": "attempt",
          "range": null,
          "search": {
            "text": {
              "ahead": "__search__.text.ahead",
              "beams": "__search__.text.beams",
              "diversity": "__search__.text.diversity",
              "repetition": "__search__.text.repetition",
              "threshold": "__search__.text.threshold",
              "topk": "__search__.text.topk",
              "width": "__search__.text.width"
            }
          }
        },
        {
          "depth": 1,
          "desc": [
            "the next step"
          ],
          "flat_index": 3,
          "format": {
            "type": "enum",
            "values": [
              "retry",
              "return"
            ]
          },
          "index": 3,
          "name": "next",
          "range": null
        }
      ],
      "flows": {
        "retry": {
          "limit": 3,
          "prompt": "solver",
          "type": "control"
        },
        "return": {
          "fields": [
            {
              "alias": "_",
              "path": [
                {
                  "name": "attempt"
                }
              ]
            }
          ],
          "type": "return"
        }
      },
      "name": "solver",
      "search": {
        "queue": {
          "metric": "__search__.queue.metric",
          "stop": "__search__.queue.stop"
        }
      }
    }
  },
  "provenance": {},
  "python_imports": {}
}
